{
  "id": "rfc7515-a2-rs256",
  "source": "RFC 7515 Appendix A.2",
  "description": "RFC 7515 Appendix A.2 compact RS256 JWT is rejected because RS256 is not an allowed algorithm.",
  "jwks": {
    "keys": []
  },
  "policy": {
    "algs": [
      "EdDSA"
    ],
    "now": 1300819379
  },
  "token": "eyJhbGciOiJSUzI1NiJ9.eyJpc3MiOiJqb2UiLA0KICJleHAiOjEzMDA4MTkzODAsDQogImh0dHA6Ly9leGFtcGxlLmNvbS9pc19yb290Ijp0cnVlfQ.cC4hiUPoj9Eetdgtv3hF80EGrhuB__dzERat0XF9g2VtQgr9PJbu3XOiZj5RZmh7AAuHIm4Bh-0Qc_lF5YKt_O8W2Fp5jujGbds9uJdbF9CUAr7t1dnZcAcQjbKBYNX4BAynRFdiuB--f_nZLgrnbyTyWzO75vRK5h6xBArLIARNPvkSjtQBMHlb1L07Qe7K0GarZRmB_eSN9383LcOLn6_dO--xi12jzDwusC-eOkHWEsqtFZESc6BfI7noOPqvhJ1phCnvWh6IeYI2w9QOYEUipUTI8np6LbgGY9Fs98rqVt5AXLIhWkWywlVmtVrBp0igcN_IoypGlUPQGe77Rw",
  "expect": {
    "ok": false,
    "error": "alg_not_allowed"
  }
}
