{
  "id": "neg-tampered-payload",
  "source": "generated",
  "description": "Rejects a token whose payload was modified after signing.",
  "jwks": {
    "keys": [
      {
        "kty": "OKP",
        "crv": "Ed25519",
        "x": "11qYAYKxCrfVS_7TyWQHOg7hcvPapiMlrwIaaPcHURo",
        "kid": "k1"
      }
    ]
  },
  "policy": {
    "algs": [
      "EdDSA"
    ],
    "now": 100
  },
  "token": "eyJhbGciOiJFZERTQSIsImtpZCI6ImsxIn0.eyJleHAiOjk5OX0.N93JNUSjUMZRTm2Ycqesy9jgFTQp7oplZcrAOxZGjRm_X2GGT82-J_ZMSVgK1aut23n0Yb2OE15uoQyotH7xDQ",
  "expect": {
    "ok": false,
    "error": "bad_signature"
  }
}
